[
  {
    "invariant_id": "INV-01HZX7M3FQ1T2Q9V8Y6K4C2B1M",
    "key": "project.phase.single_active",
    "title": "Single active phase",
    "description": "No more than one phase may be active.",
    "kind": "single_active_phase",
    "scope": "project",
    "severity": "critical",
    "enabled": true,
    "blocking": true,
    "priority": 0,
    "configuration": {},
    "remediation_hint": "Deactivate every conflicting phase.",
    "contract_version": "1.0.0",
    "schema_uri": "urn:arch:invariants:single_active_phase:1.0.0"
  },
  {
    "invariant_id": "INV-01HZX7M3FQ1T2Q9V8Y6K4C2B1N",
    "key": "project.lifecycle.phase_alignment",
    "title": "Lifecycle phase alignment",
    "description": "Lifecycle and its current phase must carry compatible status.",
    "kind": "lifecycle_phase_alignment",
    "scope": "lifecycle",
    "severity": "critical",
    "enabled": true,
    "blocking": true,
    "priority": 10,
    "configuration": {},
    "remediation_hint": "Align lifecycle and phase in one atomic patch.",
    "contract_version": "1.0.0",
    "schema_uri": "urn:arch:invariants:lifecycle_phase_alignment:1.0.0"
  },
  {
    "invariant_id": "INV-01HZX7M3FQ1T2Q9V8Y6K4C2B1P",
    "key": "project.baseline.approved_integrity",
    "title": "Approved baseline integrity",
    "description": "Baseline artifacts must remain approved and fingerprinted.",
    "kind": "approved_baseline_integrity",
    "scope": "artifact",
    "severity": "error",
    "enabled": true,
    "blocking": true,
    "priority": 20,
    "configuration": {
      "allowed_statuses": ["approved", "conditionally_approved"],
      "require_content_fingerprint": true
    },
    "remediation_hint": "Approve and fingerprint every baseline artifact.",
    "contract_version": "1.0.0",
    "schema_uri": "urn:arch:invariants:approved_baseline_integrity:1.0.0"
  },
  {
    "invariant_id": "INV-01HZX7M3FQ1T2Q9V8Y6K4C2B1Q",
    "key": "project.dependency.required_satisfaction",
    "title": "Required dependency satisfaction",
    "description": "Terminal sources cannot depend on unsatisfied required targets.",
    "kind": "required_dependency_satisfaction",
    "scope": "dependency",
    "severity": "error",
    "enabled": true,
    "blocking": true,
    "priority": 30,
    "configuration": {},
    "remediation_hint": "Satisfy the mandatory target before completion.",
    "contract_version": "1.0.0",
    "schema_uri": "urn:arch:invariants:required_dependency_satisfaction:1.0.0"
  },
  {
    "invariant_id": "INV-01HZX7M3FQ1T2Q9V8Y6K4C2B1R",
    "key": "project.requirement.traceability",
    "title": "Requirement traceability",
    "description": "Selected requirements need an aggregate-local trace.",
    "kind": "requirement_traceability",
    "scope": "requirement",
    "severity": "error",
    "enabled": true,
    "blocking": true,
    "priority": 40,
    "configuration": {
      "statuses": ["accepted", "implemented", "verified"],
      "allowed_target_types": ["artifact", "decision"]
    },
    "remediation_hint": "Link the requirement to an allowed record.",
    "contract_version": "1.0.0",
    "schema_uri": "urn:arch:invariants:requirement_traceability:1.0.0"
  },
  {
    "invariant_id": "INV-01HZX7M3FQ1T2Q9V8Y6K4C2B1S",
    "key": "project.risk.critical_control",
    "title": "Critical risk control",
    "description": "Critical risks require mitigation or an allowed accepted status.",
    "kind": "critical_risk_control",
    "scope": "risk",
    "severity": "critical",
    "enabled": true,
    "blocking": true,
    "priority": 50,
    "configuration": {
      "score_threshold": 15,
      "allowed_statuses": ["accepted", "closed"]
    },
    "remediation_hint": "Add mitigation or explicitly accept the risk.",
    "contract_version": "1.0.0",
    "schema_uri": "urn:arch:invariants:critical_risk_control:1.0.0"
  },
  {
    "invariant_id": "INV-01HZX7M3FQ1T2Q9V8Y6K4C2B1T",
    "key": "project.phase.terminal_consistency",
    "title": "Terminal phase consistency",
    "description": "Terminal phases require completion evidence.",
    "kind": "terminal_phase_consistency",
    "scope": "phase",
    "severity": "error",
    "enabled": true,
    "blocking": true,
    "priority": 60,
    "configuration": {
      "require_completed_at": true,
      "require_outputs": false
    },
    "remediation_hint": "Record the phase completion timestamp.",
    "contract_version": "1.0.0",
    "schema_uri": "urn:arch:invariants:terminal_phase_consistency:1.0.0"
  },
  {
    "invariant_id": "INV-01HZX7M3FQ1T2Q9V8Y6K4C2B1V",
    "key": "project.history.immutable_consistency",
    "title": "Immutable history consistency",
    "description": "History identity, idempotency, project and causality must be coherent.",
    "kind": "immutable_history_consistency",
    "scope": "history",
    "severity": "critical",
    "enabled": true,
    "blocking": true,
    "priority": 70,
    "configuration": {"require_causation_exists": true},
    "remediation_hint": "Correct the supplied ordered history.",
    "contract_version": "1.0.0",
    "schema_uri": "urn:arch:invariants:immutable_history_consistency:1.0.0"
  },
  {
    "invariant_id": "INV-01HZX7M3FQ1T2Q9V8Y6K4C2B1W",
    "key": "project.history.monotonic_versions",
    "title": "Monotonic record versions",
    "description": "Record versions cannot decrease or conceal content changes.",
    "kind": "monotonic_record_versions",
    "scope": "history",
    "severity": "critical",
    "enabled": true,
    "blocking": true,
    "priority": 80,
    "configuration": {},
    "remediation_hint": "Increment every changed versioned record.",
    "contract_version": "1.0.0",
    "schema_uri": "urn:arch:invariants:monotonic_record_versions:1.0.0"
  }
]
